{
  "unit_id": "grdr:deep-map-unit:synthetic-example-unit",
  "stage": "data_structure",
  "state": "verified_complete",
  "expected_count": 1,
  "registered_ids": [
    "grdr:data-structure:synthetic-example-table"
  ],
  "verified_count": 1,
  "completion_basis": "The bounded synthetic fixture exposes one declared table structure, and the fixture record was verified against its test contract.",
  "evidence": [
    {
      "url": "https://example.org/official-database-structure",
      "title": "Official synthetic database structure",
      "evidence_type": "api_documentation",
      "supports": [
        "structure",
        "expected_count"
      ],
      "retrieved_at": "2026-08-14T00:00:00Z"
    }
  ],
  "blockers": [],
  "notes": "enumeration=synthetic fixture structure; order=single declared structure; completed_native=1; last_native=example table; next_native=none; snapshot=2026-08-22"
}
