{
  "unit_id": "grdr:deep-map-unit:undata-edata",
  "stage": "variable",
  "state": "in_progress",
  "expected_count": 216,
  "registered_ids": [
    "grdr:variable:undata-energy-01",
    "grdr:variable:undata-energy-03",
    "grdr:variable:undata-energy-04",
    "grdr:variable:undata-energy-121",
    "grdr:variable:undata-energy-ga",
    "grdr:variable:undata-energy-na"
  ],
  "verified_count": 0,
  "completion_basis": null,
  "evidence": [
    {
      "url": "https://data.un.org/ws/rest/codelist/UNSD/CL_TRANSACTION_NRG/1.1",
      "title": "UNdata Energy transaction code list 1.1",
      "evidence_type": "data_dictionary",
      "supports": [
        "code",
        "label",
        "expected_count",
        "official_order",
        "variable_universe"
      ],
      "retrieved_at": "2026-08-19T10:48:20.423800+00:00"
    }
  ],
  "blockers": [],
  "notes": "enumeration=UNSD CL_TRANSACTION_NRG 1.1 with 216 codes; order=official codelist document order; completed_native=6; last_native=none because prior priority records were non-contiguous; next_native=010; snapshot=2026-08-19"
}
